{"attestation_version":"1.0","capabilities":{"cgroup_driver":"systemd","cgroup_version":"2","cpu_controller":true,"memory_controller":true,"pids_controller":true,"rootless":true},"certificate_identity":"https://github.com/hyunsuki5329/ForgeOps/.github/workflows/vg-008-e3.yml@refs/heads/main","image_digest":"sha256:48f1f12f5856955b6015529977154ddfb481f1778dd2992ab79d9bd625ce8680","image_ref":"ghcr.io/hyunsuki5329/forgeops-e3@sha256:48f1f12f5856955b6015529977154ddfb481f1778dd2992ab79d9bd625ce8680","input_hashes":{"helper_sha256":"ed3d4bee8a90c1fd23a3beec8f2edfe572a9d3baa4ff97db63109416ef1770f1","probe_sha256":"a9a37e3a279ea795fd19d1f500e265568d080a5ebd27d10d833f4aa4215912bd","runtime_profile_sha256":"3bb44e226eb7d2349d7fd8fc0767cb8a3e000307d7e7add03f5e1771e7ec0fe9","sandbox_schema_sha256":"18609692846039503c3a62ace09b378066b1b1db1b540203fee92996d5137631","sandbox_suite_sha256":"565653c17ad59ffbedb3e0472b3250c2422df626b99ee0d560ea94b9557d0913"},"issuer":"https://token.actions.githubusercontent.com","observations":[{"cap_drop_all":true,"case_id":"positive-signed-digest","connected_addresses":[],"direct_dns_calls":0,"direct_socket_calls":0,"evidence_kind":"runtime","forbidden_devices":0,"forbidden_mounts":0,"network_calls":0,"no_new_privileges":true,"observation_mode":"RUNTIME_EXECUTED","observed_at":"2026-08-30T02:25:08Z","provision_calls":1,"proxy_calls":0,"proxy_destination":"","quota_exceeded":false,"redirects":0,"residue":{"leases":0,"mounts":0,"processes":0,"transient_secrets":0,"workspaces":0},"root_uid":1000,"rootfs_read_only":true,"write_calls":0},{"cap_drop_all":true,"case_id":"negative-tag-only","connected_addresses":[],"direct_dns_calls":0,"direct_socket_calls":0,"evidence_kind":"runtime","forbidden_devices":0,"forbidden_mounts":0,"network_calls":0,"no_new_privileges":true,"observation_mode":"PREPROVISION_DENIED","observed_at":"2026-08-30T02:25:08Z","provision_calls":0,"proxy_calls":0,"proxy_destination":"","quota_exceeded":false,"redirects":0,"residue":{"leases":0,"mounts":0,"processes":0,"transient_secrets":0,"workspaces":0},"root_uid":1000,"rootfs_read_only":true,"write_calls":0},{"cap_drop_all":true,"case_id":"negative-signature-unverified","connected_addresses":[],"direct_dns_calls":0,"direct_socket_calls":0,"evidence_kind":"runtime","forbidden_devices":0,"forbidden_mounts":0,"network_calls":0,"no_new_privileges":true,"observation_mode":"PREPROVISION_DENIED","observed_at":"2026-08-30T02:25:08Z","provision_calls":0,"proxy_calls":0,"proxy_destination":"","quota_exceeded":false,"redirects":0,"residue":{"leases":0,"mounts":0,"processes":0,"transient_secrets":0,"workspaces":0},"root_uid":1000,"rootfs_read_only":true,"write_calls":0},{"cap_drop_all":true,"case_id":"negative-issuer-mismatch","connected_addresses":[],"direct_dns_calls":0,"direct_socket_calls":0,"evidence_kind":"runtime","forbidden_devices":0,"forbidden_mounts":0,"network_calls":0,"no_new_privileges":true,"observation_mode":"PREPROVISION_DENIED","observed_at":"2026-08-30T02:25:08Z","provision_calls":0,"proxy_calls":0,"proxy_destination":"","quota_exceeded":false,"redirects":0,"residue":{"leases":0,"mounts":0,"processes":0,"transient_secrets":0,"workspaces":0},"root_uid":1000,"rootfs_read_only":true,"write_calls":0},{"cap_drop_all":true,"case_id":"positive-rootless-readonly","connected_addresses":[],"direct_dns_calls":0,"direct_socket_calls":0,"evidence_kind":"runtime","forbidden_devices":0,"forbidden_mounts":0,"network_calls":0,"no_new_privileges":true,"observation_mode":"RUNTIME_EXECUTED","observed_at":"2026-08-30T02:25:08Z","provision_calls":1,"proxy_calls":0,"proxy_destination":"","quota_exceeded":false,"redirects":0,"residue":{"leases":0,"mounts":0,"processes":0,"transient_secrets":0,"workspaces":0},"root_uid":1000,"rootfs_read_only":true,"write_calls":0},{"cap_drop_all":true,"case_id":"negative-root-user","connected_addresses":[],"direct_dns_calls":0,"direct_socket_calls":0,"evidence_kind":"runtime","forbidden_devices":0,"forbidden_mounts":0,"network_calls":0,"no_new_privileges":true,"observation_mode":"PREPROVISION_DENIED","observed_at":"2026-08-30T02:25:08Z","provision_calls":0,"proxy_calls":0,"proxy_destination":"","quota_exceeded":false,"redirects":0,"residue":{"leases":0,"mounts":0,"processes":0,"transient_secrets":0,"workspaces":0},"root_uid":1000,"rootfs_read_only":true,"write_calls":0},{"cap_drop_all":true,"case_id":"negative-rootfs-writable","connected_addresses":[],"direct_dns_calls":0,"direct_socket_calls":0,"evidence_kind":"runtime","forbidden_devices":0,"forbidden_mounts":0,"network_calls":0,"no_new_privileges":true,"observation_mode":"PREPROVISION_DENIED","observed_at":"2026-08-30T02:25:08Z","provision_calls":0,"proxy_calls":0,"proxy_destination":"","quota_exceeded":false,"redirects":0,"residue":{"leases":0,"mounts":0,"processes":0,"transient_secrets":0,"workspaces":0},"root_uid":1000,"rootfs_read_only":true,"write_calls":0},{"cap_drop_all":true,"case_id":"negative-docker-socket","connected_addresses":[],"direct_dns_calls":0,"direct_socket_calls":0,"evidence_kind":"runtime","forbidden_devices":0,"forbidden_mounts":0,"network_calls":0,"no_new_privileges":true,"observation_mode":"PREPROVISION_DENIED","observed_at":"2026-08-30T02:25:08Z","provision_calls":0,"proxy_calls":0,"proxy_destination":"","quota_exceeded":false,"redirects":0,"residue":{"leases":0,"mounts":0,"processes":0,"transient_secrets":0,"workspaces":0},"root_uid":1000,"rootfs_read_only":true,"write_calls":0},{"cap_drop_all":true,"case_id":"negative-host-device","connected_addresses":[],"direct_dns_calls":0,"direct_socket_calls":0,"evidence_kind":"runtime","forbidden_devices":0,"forbidden_mounts":0,"network_calls":0,"no_new_privileges":true,"observation_mode":"PREPROVISION_DENIED","observed_at":"2026-08-30T02:25:08Z","provision_calls":0,"proxy_calls":0,"proxy_destination":"","quota_exceeded":false,"redirects":0,"residue":{"leases":0,"mounts":0,"processes":0,"transient_secrets":0,"workspaces":0},"root_uid":1000,"rootfs_read_only":true,"write_calls":0},{"cap_drop_all":true,"case_id":"positive-exact-proxy-destination","connected_addresses":[],"direct_dns_calls":0,"direct_socket_calls":0,"evidence_kind":"runtime","forbidden_devices":0,"forbidden_mounts":0,"network_calls":1,"no_new_privileges":true,"observation_mode":"RUNTIME_EXECUTED","observed_at":"2026-08-30T02:25:08Z","provision_calls":1,"proxy_calls":1,"proxy_destination":"proxy.sandbox.invalid:443","quota_exceeded":false,"redirects":0,"residue":{"leases":0,"mounts":0,"processes":0,"transient_secrets":0,"workspaces":0},"root_uid":1000,"rootfs_read_only":true,"write_calls":0},{"cap_drop_all":true,"case_id":"negative-direct-dns","connected_addresses":[],"direct_dns_calls":1,"direct_socket_calls":0,"evidence_kind":"runtime","forbidden_devices":0,"forbidden_mounts":0,"network_calls":1,"no_new_privileges":true,"observation_mode":"RUNTIME_EXECUTED","observed_at":"2026-08-30T02:25:08Z","provision_calls":1,"proxy_calls":0,"proxy_destination":"","quota_exceeded":false,"redirects":0,"residue":{"leases":0,"mounts":0,"processes":0,"transient_secrets":0,"workspaces":0},"root_uid":1000,"rootfs_read_only":true,"write_calls":0},{"cap_drop_all":true,"case_id":"negative-direct-socket","connected_addresses":[],"direct_dns_calls":0,"direct_socket_calls":1,"evidence_kind":"runtime","forbidden_devices":0,"forbidden_mounts":0,"network_calls":1,"no_new_privileges":true,"observation_mode":"RUNTIME_EXECUTED","observed_at":"2026-08-30T02:25:08Z","provision_calls":1,"proxy_calls":0,"proxy_destination":"","quota_exceeded":false,"redirects":0,"residue":{"leases":0,"mounts":0,"processes":0,"transient_secrets":0,"workspaces":0},"root_uid":1000,"rootfs_read_only":true,"write_calls":0},{"cap_drop_all":true,"case_id":"negative-loopback","connected_addresses":[],"direct_dns_calls":0,"direct_socket_calls":1,"evidence_kind":"runtime","forbidden_devices":0,"forbidden_mounts":0,"network_calls":1,"no_new_privileges":true,"observation_mode":"RUNTIME_EXECUTED","observed_at":"2026-08-30T02:25:08Z","provision_calls":1,"proxy_calls":0,"proxy_destination":"","quota_exceeded":false,"redirects":0,"residue":{"leases":0,"mounts":0,"processes":0,"transient_secrets":0,"workspaces":0},"root_uid":1000,"rootfs_read_only":true,"write_calls":0},{"cap_drop_all":true,"case_id":"negative-private-address","connected_addresses":[],"direct_dns_calls":0,"direct_socket_calls":1,"evidence_kind":"runtime","forbidden_devices":0,"forbidden_mounts":0,"network_calls":1,"no_new_privileges":true,"observation_mode":"RUNTIME_EXECUTED","observed_at":"2026-08-30T02:25:08Z","provision_calls":1,"proxy_calls":0,"proxy_destination":"","quota_exceeded":false,"redirects":0,"residue":{"leases":0,"mounts":0,"processes":0,"transient_secrets":0,"workspaces":0},"root_uid":1000,"rootfs_read_only":true,"write_calls":0},{"cap_drop_all":true,"case_id":"negative-metadata-address","connected_addresses":[],"direct_dns_calls":0,"direct_socket_calls":1,"evidence_kind":"runtime","forbidden_devices":0,"forbidden_mounts":0,"network_calls":1,"no_new_privileges":true,"observation_mode":"RUNTIME_EXECUTED","observed_at":"2026-08-30T02:25:08Z","provision_calls":1,"proxy_calls":0,"proxy_destination":"","quota_exceeded":false,"redirects":0,"residue":{"leases":0,"mounts":0,"processes":0,"transient_secrets":0,"workspaces":0},"root_uid":1000,"rootfs_read_only":true,"write_calls":0},{"cap_drop_all":true,"case_id":"negative-redirect","connected_addresses":[],"direct_dns_calls":0,"direct_socket_calls":0,"evidence_kind":"runtime","forbidden_devices":0,"forbidden_mounts":0,"network_calls":1,"no_new_privileges":true,"observation_mode":"RUNTIME_EXECUTED","observed_at":"2026-08-30T02:25:08Z","provision_calls":1,"proxy_calls":0,"proxy_destination":"","quota_exceeded":false,"redirects":1,"residue":{"leases":0,"mounts":0,"processes":0,"transient_secrets":0,"workspaces":0},"root_uid":1000,"rootfs_read_only":true,"write_calls":0},{"cap_drop_all":true,"case_id":"positive-within-quota","connected_addresses":[],"direct_dns_calls":0,"dir